{
  "$schema": "https://json-schema.org/draft/2020-12/schema",
  "$id": "https://openrisk.eu/schemas/build-config.schema.json",
  "title": "OpenRisk build configuration",
  "type": "object",
  "additionalProperties": false,
  "required": ["configVersion", "features", "availablePlugins", "branding"],
  "properties": {
    "$schema": {
      "type": "string"
    },
    "configVersion": {
      "const": 1
    },
    "features": {
      "type": "array",
      "uniqueItems": true,
      "items": {
        "type": "string",
        "minLength": 1,
        "pattern": "^[A-Za-z0-9_-]+$"
      }
    },
    "availablePlugins": {
      "type": "array",
      "uniqueItems": true,
      "items": {
        "type": "string",
        "minLength": 1,
        "pattern": "^[A-Za-z0-9._-]+$"
      }
    },
    "application": {
      "type": "object",
      "additionalProperties": false,
      "required": ["productName", "identifier", "binaryName"],
      "properties": {
        "productName": {
          "type": "string",
          "pattern": "^[A-Za-z0-9](?:[A-Za-z0-9 ._-]*[A-Za-z0-9._-])?$"
        },
        "identifier": {
          "type": "string",
          "pattern": "^[A-Za-z][A-Za-z0-9-]*(\\.[A-Za-z][A-Za-z0-9-]*)+$"
        },
        "binaryName": { "type": "string", "pattern": "^[a-z][a-z0-9-]*$" }
      }
    },
    "branding": {
      "oneOf": [
        {
          "type": "null"
        },
        {
          "type": "object",
          "additionalProperties": false,
          "required": ["name", "logo", "appIcon"],
          "properties": {
            "name": {
              "type": "string",
              "minLength": 1
            },
            "logo": {
              "type": "string",
              "minLength": 1
            },
            "appIcon": {
              "type": "string",
              "minLength": 1
            }
          }
        }
      ]
    }
  }
}
